{
  "schema_version": 1,
  "status": "passed",
  "started_at": "2026-09-13T22:53:54Z",
  "finished_at": "2026-09-13T22:55:12Z",
  "source": {
    "baseline_commit": "69f84cc2651aa259a15bc192ddaabd3baba07489",
    "qualification_commit": "7f793731f1b39eb4f465e960113d2363c311b964",
    "repository_commit": "7053c6042ea6efc12d1fd0184db8c551595f909f"
  },
  "server": {
    "image": "quay.io/ceph/ceph@sha256:6bb1c8a42fbc0bf87938946990b65174466997bc11c31eb5a323225a779fd8f9",
    "version": "ceph version 20.2.4 (7f793731f1b39eb4f465e960113d2363c311b964) tentacle (stable)"
  },
  "oracle": {
    "image_id": "sha256:20e3b60fb1075ec9db82bd6e301cbeaa76942c9d0fafb575fa3fcc8184cb9923",
    "source_sha256": "bfccf6b3593ce6abc83ac639f8d8430b18ee9c9e21bda0831e468f5d54cba1e3",
    "dockerfile_sha256": "78839fe8786ad5ce579f87d159685c0274afa3a8f504c8a49898697e4fd0a6ba",
    "compiler": "gcc-c++-11.5.0-15.el9",
    "ceph_devel": "librados-devel-20.2.4-0.el9",
    "cephpp_devel": "libradospp-devel-20.2.4-0.el9",
    "devel_repository": "https://download.ceph.com/rpm-20.2.4/el9",
    "ceph_devel_amd64_sha256": "5a8d9defce5f81634e52ad383aec7257156d355ad23a94fffc0d8df58314e195",
    "ceph_devel_arm64_sha256": "8099805cc647054564b93231680c21ea1c7a8e7d7912ecdd706374e32fe56417",
    "cephpp_devel_amd64_sha256": "e6b4af18428d87fcb6913bee11449d88fc956ead2f17cb1426b086e310b93e7a",
    "cephpp_devel_arm64_sha256": "3344fc0a7a5d66a65da1bbd4d6b815b72a7e6b290aaccc5358dae32637c85f76",
    "librados": "librados2-20.2.4-0.el9"
  },
  "client": {
    "os": "Linux",
    "architecture": "aarch64",
    "go_versions": [
      "go1.26.8",
      "go1.27.1"
    ]
  },
  "cluster": {
    "fsid": "aea2e269-39df-4476-9e55-b6b3de3b67c0",
    "replicated_profile": "size=3,min_size=2,pg=32,rule=p00-replicated-rule,failure_domain=osd",
    "ec_profile": "k=2,m=1,jerasure,reed_sol_van,pg=32,failure_domain=osd,overwrite=true"
  },
  "tests": {
    "native_crud": {
      "status": "passed",
      "evidence": {
        "status": "passed",
        "pool": "p00-replicated",
        "object": "p00-smoke-object",
        "payload_hex": "676f2d6c69627261646f732d7030300062696e617279",
        "write_version": 1,
        "read_version": 1,
        "pg_hash_position": 8
      }
    },
    "object_mapping": {
      "status": "passed",
      "evidence": {
        "epoch": 22,
        "pool": "p00-replicated",
        "pool_id": 2,
        "objname": "p00-smoke-object",
        "raw_pgid": "2.96fc93a8",
        "pgid": "2.8",
        "up": [
          0,
          2,
          1
        ],
        "up_primary": 0,
        "acting": [
          0,
          2,
          1
        ],
        "acting_primary": 0
      }
    },
    "cleanup": {
      "status": "passed",
      "evidence": {
        "cluster_state_removed": true,
        "loop_devices_detached": true,
        "oracle_image_removed": true,
        "runner_state_removed": true
      }
    }
  }
}
